{
  "schema_version": 1,
  "provider": "google",
  "display_name": "Google Workspace",
  "bundle": {
    "extension_id": "lfx-google",
    "bundle_name": "google",
    "distribution": "lfx-google"
  },
  "wave": 1,
  "max_included_actions": 8,
  "verified_on": "2026-10-02",
  "oauth_app_owner_by_context": {
    "hosted": "langflow",
    "self_managed": "customer",
    "desktop": "langflow",
    "headless": "customer"
  },
  "oauth_client_type_by_context": {
    "hosted": "confidential",
    "self_managed": "confidential",
    "desktop": "public",
    "headless": "external"
  },
  "substrate_decision": {
    "chosen": [
      "sdk"
    ],
    "decision_record": "decisions/substrate-google.md"
  },
  "restricted_scope_decisions": [
    {
      "scope": "https://www.googleapis.com/auth/gmail.readonly",
      "decision": "avoid",
      "rationale": "Release owner decision 2026-09-01 (decisions/google-restricted-scopes.md Option B): the Langflow-owned hosted app requests no restricted scope in 1.13. gmail.readonly is the narrowest scope that supports users.messages.list with a q filter plus users.messages.get for bodies; gmail.metadata is restricted as well and cannot be used with q, so it is not a narrower alternative for search.",
      "decision_record": "decisions/google-restricted-scopes.md"
    },
    {
      "scope": "https://www.googleapis.com/auth/drive.readonly",
      "decision": "avoid",
      "rationale": "Release owner decision 2026-09-01 (decisions/google-restricted-scopes.md Option B): the Langflow-owned hosted app requests no restricted scope in 1.13. drive.readonly is needed to fetch files the app did not create and the user did not pick; drive.file (non-sensitive) is the alternative and limits fetch to app-created or user-picked files.",
      "decision_record": "decisions/google-restricted-scopes.md"
    },
    {
      "scope": "https://www.googleapis.com/auth/drive.metadata.readonly",
      "decision": "avoid",
      "rationale": "Release owner decision 2026-09-01 (decisions/google-restricted-scopes.md Option B): the Langflow-owned hosted app requests no restricted scope in 1.13. Listing arbitrary Drive files needs a metadata scope beyond drive.file; drive.file-only listing returns only files the app created or the user opened with it.",
      "decision_record": "decisions/google-restricted-scopes.md"
    }
  ],
  "sources": {
    "gmail-scopes": {
      "url": "https://developers.google.com/workspace/gmail/api/auth/scopes",
      "title": "Gmail API: Choose Gmail API scopes",
      "kind": "provider_docs",
      "verified_on": "2026-10-02",
      "notes": "Table classifies gmail.labels and the add-on compose/action scopes as non-sensitive; gmail.send and the add-on metadata/readonly scopes as sensitive; mail.google.com, gmail.readonly, gmail.compose, gmail.insert, gmail.modify, gmail.metadata, gmail.settings.* as restricted."
    },
    "drive-scopes": {
      "url": "https://developers.google.com/workspace/drive/api/guides/api-specific-auth",
      "title": "Google Drive API: Choose Google Drive API scopes",
      "kind": "provider_docs",
      "verified_on": "2026-09-09",
      "notes": "drive.file, drive.appdata, drive.install are non-sensitive; drive.apps.readonly is sensitive; drive, drive.readonly, drive.metadata, drive.metadata.readonly, drive.activity*, drive.meet.readonly, drive.scripts are restricted. 'If you store restricted scope data on servers (or transmit), then you must go through a security assessment.'"
    },
    "calendar-scopes": {
      "url": "https://developers.google.com/workspace/calendar/api/auth",
      "title": "Google Calendar API: Choose Calendar API scopes",
      "kind": "provider_docs",
      "verified_on": "2026-09-09",
      "notes": "Lists every Calendar scope with its consent-screen text; the page itself carries no classification column."
    },
    "google-sensitive-scope-verification": {
      "url": "https://developers.google.com/identity/protocols/oauth2/production-readiness/sensitive-scope-verification",
      "title": "Google Identity: Sensitive scope verification",
      "kind": "provider_docs",
      "verified_on": "2026-10-02",
      "notes": "Names 'reading events stored in Google Calendar' as an example of a sensitive scope. 'The sensitive scope verification process typically takes 3-5 business days to complete.' Exemptions: personal use, testing projects, service-account-only data, Internal Workspace/Cloud Identity use, domain-wide installation."
    },
    "google-restricted-scope-verification": {
      "url": "https://developers.google.com/identity/protocols/oauth2/production-readiness/restricted-scope-verification",
      "title": "Google Identity: Restricted scope verification (CASA)",
      "kind": "provider_docs",
      "verified_on": "2026-10-02",
      "notes": "Brand verification first (typically 2-3 business days). Security assessment under the App Defense Alliance CASA framework by Google-empanelled assessors is mandatory for apps that access restricted data from or through a third-party server; it 'can potentially take several weeks to complete'; apps must be reverified at least every 12 months after the Letter of Assessment date. Unverified apps face a user cap and an unverified-app screen. Internal user type projects owned by the organization are exempt from verification but may need admin approval."
    },
    "google-oauth-app-audience": {
      "url": "https://support.google.com/cloud/answer/15549945",
      "title": "Google Cloud: Manage OAuth app audience (user type and publishing status)",
      "kind": "provider_docs",
      "verified_on": "2026-10-02",
      "notes": "Internal user type is available only to projects in a Google Cloud Organization and limits authorization to organization members. Testing publishing status is limited to 100 test users and authorizations expire seven days from consent, including refresh tokens."
    },
    "google-oauth-verification-requirements": {
      "url": "https://support.google.com/cloud/answer/13464321",
      "title": "Google Cloud: OAuth app verification requirements",
      "kind": "provider_docs",
      "verified_on": "2026-10-02",
      "notes": "Brand verification for all apps; use-case justification and demonstration video for sensitive and restricted scopes; annual external security assessment for restricted scopes."
    },
    "google-oauth2-overview": {
      "url": "https://developers.google.com/identity/protocols/oauth2",
      "title": "Google Identity: Using OAuth 2.0 to access Google APIs",
      "kind": "provider_docs",
      "verified_on": "2026-10-02",
      "notes": "Refresh token expiration reasons, the 7-day Testing expiry, the limit of 100 refresh tokens per Google Account per OAuth client, and incremental authorization guidance."
    },
    "google-oauth2-web-server": {
      "url": "https://developers.google.com/identity/protocols/oauth2/web-server",
      "title": "Google Identity: OAuth 2.0 for web server applications",
      "kind": "provider_docs",
      "verified_on": "2026-10-02",
      "notes": "Revoke endpoint https://oauth2.googleapis.com/revoke; access_type=offline; refresh_token only returned on first authorization unless prompt=consent; redirect URIs must use https except localhost and loopback IPs."
    },
    "google-oauth2-native-app": {
      "url": "https://developers.google.com/identity/protocols/oauth2/native-app",
      "title": "Google Identity: OAuth 2.0 for mobile and desktop apps",
      "kind": "provider_docs",
      "verified_on": "2026-10-02",
      "notes": "Desktop app client type; client secret is not treated as confidential; PKCE recommended; loopback redirect http://127.0.0.1:port or http://[::1]:port with a random available port; custom URI schemes and the OOB copy/paste flow are no longer supported."
    },
    "workspace-admin-app-access": {
      "url": "https://knowledge.workspace.google.com/admin/apps/control-which-apps-access-google-workspace-data",
      "title": "Google Workspace Admin Help: Control which third-party and internal apps access Google Workspace data",
      "kind": "provider_docs",
      "verified_on": "2026-09-09",
      "notes": "Access levels Trusted, Limited, Specific Google data, Blocked; Limited apps cannot reach services an admin marks Restricted; by default users can sign in with Google to any third-party app; 'Trust internal apps' allows apps from the organization's own Cloud project to access restricted Workspace APIs."
    },
    "google-workspace-mcp": {
      "url": "https://developers.google.com/workspace/guides/configure-mcp-servers",
      "title": "Google Workspace: Configure MCP servers (Developer Preview)",
      "kind": "provider_docs",
      "verified_on": "2026-10-02",
      "notes": "Eight remote servers (Gmail https://gmailmcp.googleapis.com/mcp/v1, Drive https://drivemcp.googleapis.com/mcp/v1, Docs, Sheets, Slides, Calendar https://calendarmcp.googleapis.com/mcp/v1, Chat, People). Users bring their own Google Cloud OAuth client. Gmail server requests gmail.readonly and gmail.compose; Drive server requests drive.readonly and drive.file. No rate limits or GA timeline stated."
    },
    "google-workspace-preview-program": {
      "url": "https://developers.google.com/workspace/preview",
      "title": "Google Workspace Developer Preview Program",
      "kind": "provider_docs",
      "verified_on": "2026-10-02",
      "notes": "Preview features 'may not be included in public applications prior to the General Availability (GA) announcement' and end users outside the developer's own domain may not be granted access before GA; pre-GA APIs are provided as is with no guarantee of reaching GA; features usually stay in preview 3-6 months."
    },
    "gmail-quota": {
      "url": "https://developers.google.com/workspace/gmail/api/reference/quota",
      "title": "Gmail API: Usage limits",
      "kind": "provider_docs",
      "verified_on": "2026-10-02",